[
 {
  "clause_id": "GBT30579-2022-5.12",
  "standard_code": "GB/T 30579-2022",
  "standard_name": "承压设备损伤模式识别",
  "clause_no": "5.12",
  "page": 17,
  "knowledge_type": "damage_mechanism",
  "title": "冷却水腐蚀",
  "content_raw": "5.12.1 损伤描述及损伤机理：冷却水中由溶解盐、气体、有机化合物或微生物活动引起的碳钢和其他金属的腐蚀。5.12.2 损伤形态：a) 冷却水中存在溶解氧时，冷却水对碳钢的腐蚀多为均匀腐蚀；b) 若冷却水腐蚀以垢下腐蚀、缝隙腐蚀、电偶腐蚀或微生物腐蚀为主时，多表现为局部腐蚀；c) 冷却水在管嘴的出入口或管道入口处易形成冲蚀或磨损，形成波纹状或光滑腐蚀；d) 在电阻焊制造设备或管道的焊接区域，冷却水腐蚀多沿焊缝熔合线形成腐蚀沟槽。",
  "applicable_conditions": {
   "equipment_type": [
    "换热器",
    "容器",
    "管道"
   ],
   "material": [
    "碳钢",
    "300系列不锈钢"
   ],
   "medium": [
    "循环水"
   ],
   "temperature_c": [
    null,
    null
   ],
   "pressure_mpa": [
    null,
    null
   ],
   "other": "所有水冷换热器和冷却塔设备；冷却水入口设计温度不宜高于57℃；铜、铝、钛、镍基合金也受影响（不在material枚举）"
  },
  "mechanism_detail": {
   "description": "冷却水中由溶解盐、气体、有机化合物或微生物活动引起的碳钢和其他金属的腐蚀",
   "morphology": [
    "存在溶解氧时对碳钢多为均匀腐蚀",
    "以垢下腐蚀、缝隙腐蚀、电偶腐蚀或微生物腐蚀为主时多表现为局部腐蚀",
    "管嘴出入口或管道入口处易形成波纹状或光滑腐蚀",
    "电阻焊设备或管道的焊接区域多沿焊缝熔合线形成腐蚀沟槽"
   ],
   "affected_materials": [
    "碳钢、所有不锈钢、铜、铝、钛和镍基合金"
   ],
   "influencing_factors": [
    "温度：冷却水出口温度和/或工艺物料侧入口温度升高会增加腐蚀速度和结垢倾向，工艺物料侧温度高于60℃时新鲜水存在结垢倾向，半咸水或盐水/海水出口温度高于46℃时结垢严重，超过80℃后腐蚀逐渐下降",
    "氧含量：随冷却水含氧量升高碳钢腐蚀速率增大",
    "结垢：矿物沉淀、淤泥、悬浮有机材料、腐蚀产物、氧化皮、海水和微生物形成的垢层造成垢下腐蚀",
    "流速：流速足够高可减少结垢并冲出沉积物，但不能过高以致引发冲刷腐蚀，低于1 m/s易导致结垢、沉积，壳程介质流动死区或滞留区腐蚀加剧",
    "水质：300系列不锈钢在新鲜水、半咸水、盐水/海水中可产生点蚀、缝隙腐蚀和应力腐蚀开裂，铜/锌合金会发生脱锌腐蚀，含氨或铵化合物冷却水中发生应力腐蚀开裂，电阻焊碳钢设备焊缝或热影响区在新鲜水、半咸水中严重腐蚀",
    "钛和其他阳极材料连接可能发生严重的钛氢化（温度高于82℃常见）"
   ],
   "susceptible_locations": [
    "所有水冷换热器和冷却塔设备"
   ],
   "prevention": [
    "系统改进：设计改进、运行优化和化学处理防护，冷换设备设计时冷却水走管程以尽量减少滞流区",
    "温度：入口设计温度不宜高于57℃",
    "流速：应有最小和最大流速范围限制，尤其使用盐水/海水时",
    "材质选用：选用耐蚀性好的材质，尤其在高含氯、低流速、高温度和/或水处理不当的冷却水系统中的换热设备，同时避免电偶腐蚀",
    "清洁：对换热管内外表面进行定期清洗"
   ],
   "detection_methods": [
    "水质监测：对pH值、氧含量、残存药剂量、微生物活性、冷却水出口温度、工艺物料泄漏或污染程度进行监控",
    "换热性能测算：定期测算热交换器换热性能，掌握结垢和沉积状况",
    "流速监测：用超声波流速仪检测冷却水流速",
    "采用涡流检测、漏磁检测、导波检测或内旋转检测系统对热交换器管束进行检查",
    "取样分析：对有代表性的管子进行取样剖管分析"
   ],
   "related_damages": [
    "微生物腐蚀、氯化物应力腐蚀开裂"
   ]
  },
  "rbi_detail": {
   "likelihood": null,
   "consequence": null,
   "risk_level": null,
   "risk_level_unified": null,
   "inspection_interval_year": null,
   "inspection_methods": []
  },
  "extractor": "代航",
  "verified_by": "",
  "version": "v1"
 },
 {
  "clause_id": "GBT30579-2022-5.15",
  "standard_code": "GB/T 30579-2022",
  "standard_name": "承压设备损伤模式识别",
  "clause_no": "5.15",
  "page": 21,
  "knowledge_type": "damage_mechanism",
  "title": "锅炉冷凝水腐蚀",
  "content_raw": "5.15.1 损伤描述及损伤机理：锅炉系统和蒸汽冷凝水回水管道上发生的均匀腐蚀和点蚀，多与溶解的氧气、二氧化碳有关。5.15.2 损伤形态：a) 除氧系统工作不正常时，很少的氧气就可引发锅炉冷凝水腐蚀，多表现为点蚀，呈溃疡状，在金属表面形成黄褐色或砖红色的腐蚀产物鼓包，直径从1 mm~30 mm不等，由各种腐蚀产物组成，腐蚀产物去除后，可见金属表面的腐蚀坑；b) 冷凝水回水系统的腐蚀多由二氧化碳引起，腐蚀后管壁形成平滑凹槽。",
  "applicable_conditions": {
   "equipment_type": [
    "管道",
    "换热器",
    "容器"
   ],
   "material": [
    "碳钢",
    "低合金钢",
    "300系列不锈钢"
   ],
   "medium": [
    "二氧化碳",
    "氧气"
   ],
   "temperature_c": [
    null,
    null
   ],
   "pressure_mpa": [
    null,
    null
   ],
   "other": "锅炉系统和蒸汽冷凝水回水管道；除氧系统工作不正常时氧气引发溃疡状点蚀；铜锌合金避免接触含联氨、中和胺或氨化合物的锅炉冷凝水"
  },
  "mechanism_detail": {
   "description": "锅炉系统和蒸汽冷凝水回水管道上发生的均匀腐蚀和点蚀，多与溶解的氧气、二氧化碳有关",
   "morphology": [
    "除氧系统工作不正常时少量氧气即可引发，多表现为溃疡状点蚀，金属表面形成黄褐色或砖红色腐蚀产物鼓包（直径1 mm～30 mm），去除后可见腐蚀坑",
    "冷凝水回水系统的腐蚀多由二氧化碳引起，腐蚀后管壁形成平滑凹槽"
   ],
   "affected_materials": [
    "主要为碳钢，以及一些低合金钢、300系列不锈钢和铜合金"
   ],
   "influencing_factors": [
    "关键因素为溶解的气体浓度（氧气和二氧化碳）、pH值、温度、给水水质和给水处理专用系统",
    "生成连续的四氧化三铁保护层并保持完好，足以实现对锅炉的腐蚀防护",
    "用来除锈垢和沉淀的化学处理应与专用水设施和锅炉给水处理系统的除氧剂相匹配",
    "铜锌合金应避免接触有联氨、中和胺或含氨化合物的锅炉冷凝水"
   ],
   "susceptible_locations": [
    "锅炉外部处理系统、除氧设备、给水管道、泵、冷凝水回水系统，以及级间加热器、省煤器或蒸汽发生系统的水侧和受火侧"
   ],
   "prevention": [
    "除氧处理：机械除氧的同时根据系统压力情况进行化学药剂（如催化亚硫酸钠或联氨）除氧，减少系统含氧量，残余除氧剂被夹带进入蒸汽发生系统可除去脱氧器下游混入的氧气",
    "缓蚀剂：采用结垢或沉积物控制，或者四氧化三铁保护层防护的处理方案",
    "不能降低冷凝水回流系统的二氧化碳时可能需要添加胺类缓蚀剂"
   ],
   "detection_methods": [
    "水质监测：监测pH值、导电率、氯含量、残余杀菌剂以及检测泄漏的有机固体悬浮颗粒总量",
    "操作程序：根据经验制定合理的工作程序，在复杂的锅炉水和冷凝水系统中查找即将出现或已出现爆管及冷凝水泄漏的部位",
    "表面检查：停机状态湿荧光磁粉检测可有效检测出除氧器发生的开裂"
   ],
   "related_damages": [
    "二氧化碳腐蚀、腐蚀疲劳、冲蚀、冲刷"
   ]
  },
  "rbi_detail": {
   "likelihood": null,
   "consequence": null,
   "risk_level": null,
   "risk_level_unified": null,
   "inspection_interval_year": null,
   "inspection_methods": []
  },
  "extractor": "代航",
  "verified_by": "",
  "version": "v1"
 },
 {
  "clause_id": "GBT30579-2022-5.20",
  "standard_code": "GB/T 30579-2022",
  "standard_name": "承压设备损伤模式识别",
  "clause_no": "5.20",
  "page": 28,
  "knowledge_type": "damage_mechanism",
  "title": "胺腐蚀",
  "content_raw": "5.20.1 损伤描述及损伤机理：胺处理工艺中碳钢发生的均匀腐蚀和/或局部腐蚀，胺腐蚀并非胺本身直接产生腐蚀，而是由胺液中溶解的酸性气体（二氧化碳和硫化氢）、胺降解产物、耐热胺盐（HSAS）和其他腐蚀性杂质引起的。5.20.2 损伤形态：a) 碳钢和低合金钢发生胺腐蚀时可表现为均匀腐蚀或局部腐蚀，沉积物处表现为垢下腐蚀；b) 介质流速较低时，多为均匀腐蚀，介质流速高并伴有紊流时，多为局部腐蚀。",
  "applicable_conditions": {
   "equipment_type": [
    "塔",
    "换热器",
    "容器",
    "管道"
   ],
   "material": [
    "碳钢",
    "低合金钢"
   ],
   "medium": [
    "胺液"
   ],
   "temperature_c": [
    null,
    null
   ],
   "pressure_mpa": [
    null,
    null
   ],
   "other": "胺处理系统（脱除硫化氢、二氧化碳或硫醇）；耐热胺盐（HSAS）浓度超过2%（质量分数）腐蚀显著；温度高于104℃左右酸性气体可能闪蒸产生严重局部腐蚀；碳钢富液流速不宜超过1.8 m/s"
  },
  "mechanism_detail": {
   "description": "胺处理工艺中碳钢发生的均匀腐蚀和/或局部腐蚀，并非胺本身直接产生腐蚀，而是由胺液中溶解的酸性气体（二氧化碳和硫化氢）、胺降解产物、耐热胺盐（HSAS）和其他腐蚀性杂质引起",
   "morphology": [
    "碳钢和低合金钢可表现为均匀腐蚀或局部腐蚀，沉积物处表现为垢下腐蚀",
    "介质流速较低时多为均匀腐蚀，流速高并伴有紊流时多为局部腐蚀"
   ],
   "affected_materials": [
    "碳钢、低合金钢"
   ],
   "influencing_factors": [
    "介质：对碳钢和低合金钢的侵蚀性从大到小为单乙醇胺（MEA）、二甘醇胺（DGA）、二异丙胺（DIPA）、二乙醇胺（DEA）和甲基二乙醇胺（MDEA）",
    "胺液浓度：贫胺液导电性差和/或pH值高一般没有腐蚀性，耐热胺盐（HSAS）浓度超过2%（质量分数）时腐蚀速率显著增大",
    "杂质：氨、硫化氢和氰化氢等杂质会加速腐蚀，多发生于再生塔塔顶冷凝器、出口管道以及回流管道、阀和泵处",
    "温度：随温度升高腐蚀速率增大，富胺环境中压力降足够大且温度高于104℃左右时酸性气体可能闪蒸产生严重局部腐蚀",
    "流速：低流速区一般均匀腐蚀，高流速并存在紊流时造成局部腐蚀"
   ],
   "susceptible_locations": [
    "各类胺处理系统（常减压、焦化、流化床催化裂化、重整加氢、加氢裂化和尾气处理装置中的胺处理系统）",
    "再生塔塔底再沸器和再生器（胺液温度最高且介质紊流最强区域）",
    "贫胺/富胺溶液热交换器的富胺侧、高温贫胺管道、高温富胺管道、胺液泵以及回收设备"
   ],
   "prevention": [
    "处理量：控制合适的处理量避免胺液中腐蚀性杂质浓度过高",
    "温度：控制再沸器温度和流量并控制再生塔塔顶温度避免胺高温降解产生腐蚀性产物",
    "压力：控制高温部位局部压力降低闪蒸程度",
    "材质：无法避免闪蒸时采用300系列不锈钢或其他耐蚀合金，吸收塔和汽提塔宜采用410不锈钢塔盘和内件",
    "耐热胺盐浓度：控制在可接受范围内，防止氧气窜入减少耐热胺盐形成，胺储罐和物料缓冲罐充惰性气体保护",
    "设计和操作：设计合理操作正确时大多数部件可用碳钢，过滤和工艺控制可除去胺液中固体颗粒和烃组分（富胺液过滤效果更佳）",
    "流速：碳钢输送富液流速不宜超过1.8 m/s，输送贫胺液可放宽至6 m/s",
    "缓蚀剂：可添加合适的缓蚀剂"
   ],
   "detection_methods": [
    "设备内部目视检测和腐蚀部位壁厚测定",
    "只能从外部检测时用超声波自动扫查、导波检测或射线成像查找减薄部位并测厚",
    "腐蚀探针或挂片：监控实时腐蚀速率（尤其温度较高部位，如再沸器进料管道和回流管道、高温贫胺/富胺管道、汽提塔塔顶冷凝器的管道）"
   ],
   "related_damages": [
    "胺应力腐蚀开裂"
   ]
  },
  "rbi_detail": {
   "likelihood": null,
   "consequence": null,
   "risk_level": null,
   "risk_level_unified": null,
   "inspection_interval_year": null,
   "inspection_methods": []
  },
  "extractor": "代航",
  "verified_by": "",
  "version": "v1"
 },
 {
  "clause_id": "GBT30579-2022-5.24",
  "standard_code": "GB/T 30579-2022",
  "standard_name": "承压设备损伤模式识别",
  "clause_no": "5.24",
  "page": 34,
  "knowledge_type": "damage_mechanism",
  "title": "酸性水腐蚀(酸式酸性水)",
  "content_raw": "5.24.1 损伤描述及损伤机理：含有硫化氢且pH值介于4.5~7.0的酸性水引起的金属腐蚀，介质中也可能含有二氧化碳。5.24.2 损伤形态：a) 酸式酸性水腐蚀一般为均匀腐蚀，有氧存在时易发生局部腐蚀或沉积垢下局部腐蚀，含有二氧化碳的环境还可能同时出现碳酸盐应力腐蚀；b) 300系列不锈钢易发生点蚀，还可能出现缝隙腐蚀，以及氯化物应力腐蚀开裂。",
  "applicable_conditions": {
   "equipment_type": [
    "塔",
    "换热器",
    "容器",
    "管道"
   ],
   "material": [
    "碳钢",
    "300系列不锈钢"
   ],
   "medium": [
    "酸式酸性水"
   ],
   "temperature_c": [
    null,
    null
   ],
   "pressure_mpa": [
    null,
    null
   ],
   "other": "硫化氢且pH值4.5～7.0的酸性水；温度低于60℃可用300系列不锈钢；铝合金和镍基合金不敏感（部分不在material枚举）"
  },
  "mechanism_detail": {
   "description": "含有硫化氢且pH值介于4.5～7.0的酸性水引起的金属腐蚀，介质中也可能含有二氧化碳",
   "morphology": [
    "一般为均匀腐蚀，有氧存在时易发生局部腐蚀或沉积垢下局部腐蚀，含二氧化碳环境还可能同时出现碳酸盐应力腐蚀开裂",
    "300系列不锈钢易发生点蚀、缝隙腐蚀，以及氯化物应力腐蚀开裂"
   ],
   "affected_materials": [
    "碳钢耐酸性水腐蚀能力较低",
    "300系列不锈钢、铝合金和镍基合金对酸性水腐蚀不敏感"
   ],
   "influencing_factors": [
    "硫化氢浓度：升高则腐蚀速率增大，取决于气相中硫化氢分压、温度和pH值，一定压力下随温度升高而降低",
    "pH值：硫化氢浓度增加降低pH值（最低可达4.5）形成较弱的酸性环境腐蚀明显，pH值高于4.5时可能形成硫化亚铁保护膜减少腐蚀速率，但有时形成多孔硫化亚铁膜反而促进垢下腐蚀",
    "杂质：氰化氢和二氧化碳降低pH值（酸性变强），氨使pH值升高且可能形成碱式酸性水腐蚀，空气或氧化剂存在会增加腐蚀（常形成点蚀或垢下腐蚀）",
    "流速：高流速或湍流易使硫化亚铁保护膜被破坏，腐蚀速率增大"
   ],
   "susceptible_locations": [
    "流化床催化裂化装置和焦化装置气体分馏系统中塔顶硫化氢含量高、氨含量低的部位",
    "乙烯裂解装置急冷部分：急冷水塔顶裂解气至压缩部分的裂解气压缩机入口流程、汽油分馏塔塔顶裂解气至急冷水塔进料流程",
    "乙烯裂解装置压缩系统：裂解气自急冷水塔顶至裂解气压缩机1～4段流程及相连管道、分离罐底部冷凝的裂解汽油至汽油汽提塔流程、冷凝水至急冷水塔入口流程、汽油汽提塔相关流程"
   ],
   "prevention": [
    "温度低于60℃可用300系列不锈钢，且基本不用考虑氯化物应力腐蚀开裂问题",
    "铜合金和镍基合金一般不易发生酸式酸性水腐蚀，但当存在氨时铜合金易发生腐蚀"
   ],
   "detection_methods": [
    "壁厚测定：碳钢一般为均匀腐蚀，高流速或湍流区域（尤其水汽凝结部位）会发生局部腐蚀，可采用超声波检测或射线成像检测确定减薄状况",
    "工艺防腐和腐蚀监测：定期对塔顶贮罐中水采样进行pH值监测",
    "探针或挂片：设置探针或挂片，监控腐蚀程度"
   ],
   "related_damages": [
    "湿硫化氢破坏、碳酸盐应力腐蚀开裂"
   ]
  },
  "rbi_detail": {
   "likelihood": null,
   "consequence": null,
   "risk_level": null,
   "risk_level_unified": null,
   "inspection_interval_year": null,
   "inspection_methods": []
  },
  "extractor": "代航",
  "verified_by": "",
  "version": "v1"
 },
 {
  "clause_id": "GBT30579-2022-5.27",
  "standard_code": "GB/T 30579-2022",
  "standard_name": "承压设备损伤模式识别",
  "clause_no": "5.27",
  "page": 38,
  "knowledge_type": "damage_mechanism",
  "title": "含盐水腐蚀",
  "content_raw": "5.27.1 损伤描述及损伤机理：含有溶解盐（通常是氯化物或其他卤化物盐）的水溶液，可造成设备表面局部或大范围点蚀。含盐水腐蚀常与其他腐蚀（如电偶腐蚀、微生物腐蚀）同时出现。不锈钢在氯化物盐水中发生腐蚀时，钝化层被氯化物破坏的部位会形成点蚀坑，随着氯化物在电泳作用下向坑内迁移，水解产生的酸性物质降低坑中溶液pH值，形成自催化，加速腐蚀。缝隙部位也容易产生这样的自催化腐蚀过程。类似的过程也会发生在裂缝中。",
  "applicable_conditions": {
   "equipment_type": [
    "换热器",
    "管道",
    "容器"
   ],
   "material": [
    "碳钢",
    "低合金钢",
    "300系列不锈钢",
    "双相不锈钢"
   ],
   "medium": [
    "含盐水"
   ],
   "temperature_c": [
    null,
    null
   ],
   "pressure_mpa": [
    null,
    null
   ],
   "other": "含溶解盐（通常为氯化物等卤化物盐）的水溶液；原油常减压脱盐及脱盐废水系统、污水处理系统、盐产品脱水干燥器、海水（消防用水）系统、软化水再生系统；铝合金、铜合金、Ni-Cr-Mo合金、镍基合金也受影响（部分不在material枚举）；海水中合金一般要求PRE不低于40；氯气浓度超过0.5×10⁻⁶时腐蚀加速"
  },
  "mechanism_detail": {